{
  "id": "bitsat",
  "name": "BITSAT",
  "aliases": [
    "बिटसैट",
    "bits"
  ],
  "body": "BITS Pilani",
  "category": "entrance",
  "portal": null,
  "live_photo_capture": null,
  "status": "active",
  "documents": [
    {
      "type": "photo",
      "required": true,
      "formats": [
        "jpg",
        "jpeg"
      ],
      "size_kb": {
        "min": null,
        "max": 100,
        "target": 70
      },
      "dimensions": {
        "mode": "none"
      },
      "notes": "3.5 x 4.5 cm"
    },
    {
      "type": "signature",
      "required": true,
      "formats": [
        "jpg",
        "jpeg"
      ],
      "size_kb": {
        "min": null,
        "max": 50,
        "target": 35
      },
      "dimensions": {
        "mode": "none"
      },
      "notes": "3.5 x 1.5 cm"
    }
  ],
  "special_rules": [],
  "sources": [
    {
      "url": "https://docset.in/resize/bitsat-2026/",
      "kind": "secondary"
    }
  ],
  "confidence": "low",
  "confidence_note": "Single secondary source",
  "last_verified": "2026-09-30"
}
